{
  "ok": true,
  "data": {
    "session_id": "S-2026-10-09-1",
    "log": "Scaffold/Sessions/S-2026-10-09-1.md",
    "calibration": "Confident and right: 1. Confident and wrong: 0. Unsure but right: 0.",
    "answers_recorded": 2,
    "next_preview": "Lattice diagrams with a real termination.",
    "weekly_report": "Scaffold/Learner/Weekly/2026-10-09.md"
  },
  "warnings": [
    "No exit-ticket answer was recorded this session (TP-15).",
    "Weekly report written: Scaffold/Learner/Weekly/2026-10-09.md"
  ],
  "errors": []
}