{
  "ok": true,
  "data": {
    "visual_id": "V-0002",
    "status": "accepted",
    "attempt": 1,
    "format": "svg",
    "static": {
      "ok": true,
      "errors": [],
      "warnings": []
    },
    "files": [
      "Scaffold/Visuals/V-0002/figure.svg",
      "Scaffold/Visuals/V-0002/spec.md"
    ],
    "next_step": "Pass visual_ids [\"V-0002\"] to mark_taught. Terminal front-ends: `scaffold visual open V-0002`."
  },
  "warnings": [],
  "errors": []
}