{
  "ok": true,
  "data": {
    "id": "music-theory",
    "title": "Music theory",
    "aliases": [
      "music"
    ],
    "scope": "active",
    "kcs": 4,
    "due": 2,
    "solid": 0,
    "fragile": 1,
    "forgotten": 1,
    "misconceptions": 0,
    "last_session": "2026-09-25",
    "anki_deck": "Scaffold::Music theory"
  },
  "warnings": [],
  "errors": []
}