{
  "ok": true,
  "data": {
    "concepts": [
      {
        "id": "kc-jb-random-jitter",
        "created": true,
        "changed": [],
        "note": "Scaffold/Concepts/kc-jb-random-jitter.md"
      },
      {
        "id": "kc-jb-ber",
        "created": true,
        "changed": [],
        "note": "Scaffold/Concepts/kc-jb-ber.md"
      }
    ]
  },
  "warnings": [],
  "errors": []
}