{
  "ok": true,
  "data": {
    "checks": [
      {
        "id": "vault",
        "ok": true,
        "message": "Vault: <VAULT>"
      },
      {
        "id": "folders",
        "ok": true,
        "message": "All Scaffold folders exist and are writable."
      },
      {
        "id": "schema",
        "ok": true,
        "message": "Event schema v1 (expected v1)."
      },
      {
        "id": "config",
        "ok": true,
        "message": "config.json is valid."
      },
      {
        "id": "events",
        "ok": true,
        "message": "events.jsonl: 74 valid events."
      },
      {
        "id": "graph",
        "ok": true,
        "message": "Concept graph: 14 KCs, no cycles or dangling ids."
      },
      {
        "id": "queue",
        "ok": true,
        "message": "Anki queue is empty."
      },
      {
        "id": "links",
        "ok": true,
        "message": "No unresolved links in Scaffold notes."
      },
      {
        "id": "anki",
        "ok": false,
        "message": "Anki is closed or AnkiConnect is missing: nothing answers at http://127.0.0.1:9/.",
        "next_step": "Open Anki. If it is open, install AnkiConnect (Tools → Add-ons → Get Add-ons…, code 2055492159) and restart Anki. Until then, Anki operations are queued (ANK-09).",
        "warn": true
      },
      {
        "id": "anki_mirror",
        "ok": true,
        "message": "No Anki sync yet; run `scaffold anki sync` once Anki is open."
      },
      {
        "id": "anki_budgets",
        "ok": true,
        "message": "Anki budgets fit in the daily total."
      }
    ]
  },
  "warnings": [],
  "errors": []
}