{
  "ok": true,
  "data": {
    "attempt_id": "A80a09c2a573e5be",
    "duplicate": false,
    "grade": "incorrect",
    "graded_by": "grader",
    "assisted": false,
    "status": {
      "kc-si-reflection-coefficient": {
        "before": "forgotten",
        "after": "forgotten"
      }
    },
    "misconception": {
      "id": "M-0001",
      "state": "open",
      "opened_now": false
    },
    "card_eligible": false,
    "misconceptions_targeted": [
      {
        "id": "M-0001",
        "state": "open",
        "resolve_progress": {
          "questions": 0,
          "sessions": 0
        }
      }
    ]
  },
  "warnings": [],
  "errors": []
}